{
  "schemaVersion": 1,
  "caseId": "noop-newer-publication-stale-effective",
  "action": "NO_ACTION",
  "firstMaterialDivergence": "The retrospective observation reports status \"offered\" effective 2026-08-10T12:00:00.000Z, which predates athlete-51's canonical committed state effective 2026-08-20T18:00:00.000Z; its newer observation/publication time cannot supersede the later effective state.",
  "failureOwner": "No failure: the canonical record correctly preserves the later effective state.",
  "evidenceUsed": [
    "input/canonical.json",
    "obs-new-publication-old-state",
    "input/policy.json"
  ],
  "evidenceRejected": [
    "obs-new-publication-old-state"
  ],
  "affectedEntities": [
    "athlete-51"
  ],
  "affectedFiles": [],
  "operations": [
    {
      "kind": "NO_MUTATION",
      "reason": "The only observation is historical and has an earlier effective time than the canonical record; policy requires comparison by effective time."
    }
  ],
  "preservedInvariants": [
    "Effective state never rolls backward because publication is newer"
  ],
  "unresolvedUncertainty": [],
  "minimumInformationRequest": [],
  "retryCondition": null,
  "approvalLevel": "NONE",
  "summary": "Keep canonical state unchanged. The newer archival observation is valid evidence of an older offered state, not authority to roll athlete-51 back from committed."
}
