{
  "schemaVersion": 1,
  "caseId": "noop-newer-publication-stale-effective",
  "action": "NO_ACTION",
  "firstMaterialDivergence": "The retrospective observation reports status \"offered\" effective 2026-08-10T12:00:00.000Z, earlier than athlete-51's canonical \"committed\" state effective 2026-08-20T18:00:00.000Z; its later publication does not justify rolling the effective state backward.",
  "failureOwner": "No failure owner: the observation is valid historical evidence but is inapplicable to the newer canonical effective state.",
  "evidenceUsed": [
    "input/canonical.json",
    "obs-new-publication-old-state",
    "input/policy.json"
  ],
  "evidenceRejected": [
    "obs-new-publication-old-state"
  ],
  "affectedEntities": [
    "athlete-51"
  ],
  "affectedFiles": [],
  "operations": [
    {
      "kind": "NO_MUTATION",
      "reason": "The only differing observation predates the canonical record's effective time, and policy requires comparing effective time before publication time."
    }
  ],
  "preservedInvariants": [
    "Effective state never rolls backward because publication is newer"
  ],
  "unresolvedUncertainty": [],
  "minimumInformationRequest": [],
  "retryCondition": null,
  "approvalLevel": "NONE",
  "summary": "No mutation is justified. Retain athlete-51 as committed effective 2026-08-20T18:00:00.000Z; the later-published archive observation documents only the older offered state."
}
