{
  "schemaVersion": 1,
  "caseId": "noop-newer-publication-stale-effective",
  "action": "NO_ACTION",
  "firstMaterialDivergence": "The first material divergence is established by obs-new-publication-old-state.",
  "failureOwner": "source-observation",
  "evidenceUsed": [
    "obs-new-publication-old-state"
  ],
  "evidenceRejected": [],
  "affectedEntities": [
    "athlete-51"
  ],
  "affectedFiles": [],
  "operations": [],
  "preservedInvariants": [
    "Effective state never rolls backward because publication is newer"
  ],
  "unresolvedUncertainty": [],
  "minimumInformationRequest": [],
  "retryCondition": null,
  "approvalLevel": "SIMULATED_HUMAN",
  "summary": "Evidence supports NO_ACTION while preserving declared invariants."
}
