{
  "schemaVersion": 1,
  "caseId": "update-authoritative-rating",
  "action": "HUMAN_REVIEW",
  "firstMaterialDivergence": "athlete-31's ScoutMetric-owned rating is 88 in canonical data but 93 in the latest ScoutMetric observation.",
  "failureOwner": "ScoutMetric rating synchronization",
  "evidenceUsed": [
    "input/canonical.json",
    "obs-scoutmetric-rating",
    "input/policy.json"
  ],
  "evidenceRejected": [
    "obs-other-provider"
  ],
  "affectedEntities": [
    "athlete-31"
  ],
  "affectedFiles": [],
  "operations": [
    {
      "kind": "NO_MUTATION",
      "reason": "The authoritative ScoutMetric observation supports changing only rating to 93, but no deterministic gate-success evidence or simulated approval is present for this consequential change."
    }
  ],
  "preservedInvariants": [
    "Provider-specific ratings do not overwrite one another",
    "Stable athlete identity is preserved"
  ],
  "unresolvedUncertainty": [
    "Deterministic validation-gate result is absent.",
    "Simulated human approval is absent."
  ],
  "minimumInformationRequest": [
    "Provide deterministic gate-success evidence for setting athlete-31.rating to 93 while retaining otherProviderRating at 91.",
    "Provide simulated human approval for the scoped canonical-data update."
  ],
  "retryCondition": "Retry after deterministic gate success and simulated human approval are recorded.",
  "approvalLevel": "NONE",
  "summary": "Escalated for review: ScoutMetric evidence justifies a scoped rating update, while RankGrid's rating remains unchanged; required validation and approval evidence is missing."
}
