{
  "schemaVersion": 1,
  "caseId": "repair-pagination",
  "action": "REPAIR_ADAPTER",
  "firstMaterialDivergence": "The first material divergence is established by obs-pagination-token.",
  "failureOwner": "source-adapter",
  "evidenceUsed": [
    "obs-pagination-token"
  ],
  "evidenceRejected": [],
  "affectedEntities": [],
  "affectedFiles": [
    "adapter.ts"
  ],
  "operations": [
    {
      "kind": "REPLACE_TEXT",
      "file": "adapter.ts",
      "find": "export function collectPages(loadPage: (address: string) => Page, start: string): string[] {\n  const records: string[] = [];\n  let page = Number(start);\n  while (Number.isInteger(page) && page <= 3) {\n    records.push(...loadPage(String(page)).records);\n    page += 1;\n  }\n  return records;\n}",
      "replace": "export function collectPages(loadPage: (address: string) => Page, start: string): string[] {\n  const records: string[] = [];\n  const seen = new Set<string>();\n  let address: string | null = start;\n  while (address !== null) {\n    if (seen.has(address)) throw new Error(\"Pagination cycle detected\");\n    seen.add(address);\n    const page = loadPage(address);\n    records.push(...page.records);\n    address = page.nextPage;\n  }\n  return [...new Set(records)];\n}",
      "expectedCount": 1
    }
  ],
  "preservedInvariants": [
    "Every fixture record appears exactly once",
    "Historical numeric pagination remains supported"
  ],
  "unresolvedUncertainty": [],
  "minimumInformationRequest": [],
  "retryCondition": null,
  "approvalLevel": "SIMULATED_HUMAN",
  "summary": "Evidence supports REPAIR_ADAPTER while preserving declared invariants."
}
