{
  "schemaVersion": 1,
  "caseId": "retry-deferred-406",
  "action": "REPAIR_ADAPTER",
  "firstMaterialDivergence": "The adapter treated the contractually deferred HTTP 406 response as authoritative removal data instead of retaining the valid cached record and scheduling a bounded retry.",
  "failureOwner": "source-response adapter",
  "evidenceUsed": [
    "input/canonical.json",
    "obs-deferred-406",
    "input/policy.json"
  ],
  "evidenceRejected": [],
  "affectedEntities": [
    "source-41",
    "public-provider"
  ],
  "affectedFiles": [],
  "operations": [
    {
      "kind": "NO_MUTATION",
      "reason": "No write path is allowed; repair the adapter behavior in the later sandbox workflow to preserve cached records on expected 406 deferrals and schedule a bounded retry."
    }
  ],
  "preservedInvariants": [
    "A deferred response cannot delete cached records",
    "Retries are bounded"
  ],
  "unresolvedUncertainty": [
    "The supplied evidence does not identify the adapter source file or its exact retry-state representation."
  ],
  "minimumInformationRequest": [],
  "retryCondition": "Retry public-provider after 30 minutes, with no more than two attempts, while retaining source-41's valid cache.",
  "approvalLevel": "SIMULATED_HUMAN",
  "summary": "Propose an adapter repair: classify the observed 406 as an expected temporary deferral, retain the authoritative cache of 42 records, and schedule the policy-bounded retry."
}
