{
  "schemaVersion": 1,
  "caseId": "review-conflicting-authorities",
  "action": "HUMAN_REVIEW",
  "firstMaterialDivergence": "At effectiveAt 2026-08-27T14:00:00.000Z, obs-athletics-active reports status active while obs-registrar-withdrawn reports status withdrawn for athlete-71; both sources are authoritative for participation-status and neither supplies a supersession edge.",
  "failureOwner": "Cross-system status governance between official-athletics-roster and official-registrar",
  "evidenceUsed": [
    "obs-athletics-active",
    "obs-registrar-withdrawn",
    "input/policy.json",
    "input/canonical.json"
  ],
  "evidenceRejected": [],
  "affectedEntities": [
    "athlete-71"
  ],
  "affectedFiles": [],
  "operations": [
    {
      "kind": "NO_MUTATION",
      "reason": "Policy requires escalation for co-authoritative conflicting values at the same effective time and a signed cross-system resolution with an effective timestamp; neither is present."
    }
  ],
  "preservedInvariants": [
    "Conflicting co-authoritative records cannot be resolved by source order",
    "Canonical state remains unchanged without a supersession edge"
  ],
  "unresolvedUncertainty": [
    "Which status is the signed cross-system resolution for athlete-71 at 2026-08-27T14:00:00.000Z.",
    "What effective timestamp applies to the signed cross-system resolution."
  ],
  "minimumInformationRequest": [
    "Provide a signed cross-system resolution identifying the authoritative status for athlete-71 and its effective timestamp."
  ],
  "retryCondition": null,
  "approvalLevel": "SIMULATED_HUMAN",
  "summary": "Escalation is required because two co-authoritative records conflict at the same effective time without supersession; retain the existing canonical record pending signed cross-system resolution."
}
