{
  "schemaVersion": 1,
  "caseId": "retry-deferred-406",
  "action": "RETRY_LATER",
  "firstMaterialDivergence": "The first material divergence is established by obs-deferred-406.",
  "failureOwner": "source-observation",
  "evidenceUsed": [
    "obs-deferred-406"
  ],
  "evidenceRejected": [],
  "affectedEntities": [],
  "affectedFiles": [],
  "operations": [],
  "preservedInvariants": [
    "A deferred response cannot delete cached records",
    "Retries are bounded"
  ],
  "unresolvedUncertainty": [],
  "minimumInformationRequest": [],
  "retryCondition": "Retry after 30 minutes while retaining cache.",
  "approvalLevel": "SIMULATED_HUMAN",
  "summary": "Evidence supports RETRY_LATER while preserving declared invariants."
}
